{
  "$schema": "http://json-schema.org/draft-07/schema#",
  "$id": "https://www.schemastore.org/odgs-ontology-graph.json",
  "$comment": "Vendored from the Open Data Governance Standard (ODGS) reference implementation, https://github.com/MetricProvenance/odgs-protocol/blob/main/2_INFORMATIVE_REFERENCE/src/odgs/schemas/validation/ontology.schema.json (canonical $id: https://odgs.org/schemas/ontology.schema.json). ODGS is on a path toward formal standardization; learn more at https://www.metricprovenance.com/start.",
  "title": "ODGS Ontology Graph",
  "description": "ODGS business-entity ontology graph for AI graph traversal.",
  "type": "object",
  "properties": {
    "meta": {
      "type": "object",
      "properties": {
        "schema_version": {
          "type": "string"
        },
        "project_name": {
          "type": "string"
        },
        "description": {
          "type": "string"
        },
        "urn_format": {
          "type": "string"
        }
      },
      "required": ["project_name"]
    },
    "domains": {
      "type": "object",
      "patternProperties": {
        "^.*$": {
          "type": "object",
          "properties": {
            "source_file": {
              "type": "string"
            },
            "urn_prefix": {
              "type": "string"
            }
          },
          "required": ["urn_prefix"]
        }
      }
    },
    "relationship_types": {
      "type": "array",
      "items": {
        "type": "object",
        "properties": {
          "type": {
            "type": "string"
          },
          "description": {
            "type": "string"
          }
        },
        "required": ["type"]
      }
    },
    "graph_edges": {
      "type": "array",
      "items": {
        "type": "object",
        "properties": {
          "comment": {
            "type": "string"
          },
          "link_id": {
            "type": "string"
          },
          "source_urn": {
            "type": "string"
          },
          "target_urn": {
            "type": "string"
          },
          "relationship": {
            "type": "string"
          },
          "weight": {
            "type": "number"
          },
          "description": {
            "type": "string"
          }
        },
        "anyOf": [
          {
            "properties": {
              "comment": {
                "type": "string"
              }
            },
            "required": ["comment"]
          },
          {
            "properties": {
              "link_id": {
                "type": "string"
              },
              "source_urn": {
                "type": "string"
              },
              "target_urn": {
                "type": "string"
              },
              "relationship": {
                "type": "string"
              }
            },
            "required": ["link_id", "source_urn", "target_urn", "relationship"]
          }
        ]
      }
    }
  },
  "required": ["graph_edges"]
}
