{
  "domains": {
    "metric": {
      "source_file": "standard_metrics.json",
      "urn_prefix": "urn:odgs:metric:"
    },
    "rule": {
      "source_file": "standard_data_rules.json",
      "urn_prefix": "urn:odgs:rule:"
    }
  },
  "graph_edges": [
    {
      "link_id": "L-001",
      "relationship": "enforces",
      "source_urn": "urn:odgs:rule:gdpr_art_9_biometric_consent",
      "target_urn": "urn:odgs:metric:data_completeness_rate"
    },
    {
      "comment": "Legacy edge retained for backward compatibility with v5 graphs."
    }
  ],
  "meta": {
    "description": "The connective tissue linking Metrics, Rules, Processes, Factors, and Dimensions into a single traversable graph for AI grounding and automated governance.",
    "project_name": "ODGS_Master_Ontology",
    "schema_version": "1.0",
    "urn_format": "urn:odgs:<domain>:<id>"
  },
  "relationship_types": [
    {
      "description": "A rule enforces a metric's definition.",
      "type": "enforces"
    }
  ]
}
